{
  "schema_version": "0.3.0",
  "initial_state": {
    "admitted_tokens": ["tok-workflow-triage"],
    "token_states": {
      "tok-workflow-triage": "active"
    },
    "certified_capital": 6.5
  },
  "packets": [
    {
      "id": "pkt-deprecation-001",
      "type": "deprecation",
      "token_id": "tok-workflow-triage",
      "version": "0.3.0",
      "state": "active",
      "scope_hash": "sha256:scope-workflow-triage-v1",
      "declaration": {
        "scope": {
          "receiver_class": "software-maintenance-agent",
          "context_law": "heldout-repository-repair"
        },
        "reason": "baseline refresh removed positive certified margin"
      },
      "evidence": {
        "audit_record": "audit-baseline-refresh-v2"
      },
      "bounds": {
        "value_upper_bound": 2.0,
        "cost_lower_bound": 2.5,
        "risk_lower_bound": 0.0,
        "transport_lower_bound": 0.0
      },
      "validity": {
        "hazard": {
          "status": "valid"
        }
      },
      "monitor": {
        "deprecation_scope": "baseline-refresh-v2"
      },
      "fallback": {
        "action": "deprecate",
        "resurrection_rule": "new admission packet must address baseline-refresh-v2"
      },
      "signatures": []
    },
    {
      "id": "pkt-resurrection-001",
      "type": "resurrection",
      "token_id": "tok-workflow-triage",
      "version": "0.3.0",
      "state": "deprecated",
      "scope_hash": "sha256:scope-workflow-triage-v2",
      "declaration": {
        "old_negative_certificate_id": "pkt-deprecation-001",
        "repair_summary": "new evidence addresses baseline-refresh-v2"
      },
      "evidence": {
        "overwriting_evidence": "new heldout certification split"
      },
      "bounds": {
        "value_lower_bound": 8.0,
        "cost_upper_bound": 2.0,
        "risk_upper_bound": 1.0,
        "transport_upper_bound": 1.0,
        "raw_net_capital_lower_bound": 3.0
      },
      "validity": {
        "hazard": {
          "status": "valid"
        },
        "finality": {
          "state": "finalized"
        }
      },
      "monitor": {
        "status": "resurrection"
      },
      "fallback": {
        "action": "return-to-candidate"
      },
      "signatures": []
    }
  ],
  "transitions": [
    {
      "decision": "deprecate"
    },
    {
      "decision": "resurrect"
    }
  ],
  "final_state": {
    "certified_capital": 6.5,
    "token_states": {
      "tok-workflow-triage": "candidate"
    }
  }
}
